{
  "channel_manifest_version": "1",
  "channel": "stable",
  "updated_at": "2026-02-22T18:04:06.830Z",
  "latest_version": "0.9.10",
  "release_manifest": "https://clawmaster.org/.well-known/clawmaster-install/releases/0.9.10.json",
  "release_notes_url": "https://github.com/clawmaster-org/clawmaster/releases/tag/v0.9.10"
}
